{
  "id": "nord",
  "name": "Nord",
  "scheme": "dark",
  "source": "https://github.com/nordtheme/nord",
  "author": "Arctic Ice Studio",
  "license": "MIT",
  "attribution": "Nord by Arctic Ice Studio",
  "changes": [
    "text-secondary on raised: #9AA5B5 -> #A6AFBE to reach 4.5:1 on #3B4252",
    "control-border: #434C5E -> #6F7D98 to reach 3.0:1 on #2E3440",
    "--vd-status-success: #A3BE8C -> #B0C79C to reach 4.56:1 on --vd-surface, --vd-surface-raised, --vd-surface-brand, --vd-surface-subtle (was 4.08:1)",
    "--vd-status-error: #BF616A -> #E1B4B9 to reach 4.53:1 on --vd-surface, --vd-surface-raised, --vd-surface-brand, --vd-surface-subtle (was 2.03:1)",
    "--vd-code-surface: #272C36 -> #1B1F26 to keep the code block's fixed metadata ink at 4.56:1 (was 3.86:1)",
    "--vd-text-secondary: #A6AFBE -> #B8C0CB to reach 4.5:1 on --vd-tint, --vd-surface-brand (worst was 3.76:1, now 4.53:1)",
    "--vd-control-border: #6F7D98 -> #919CB1 to reach 3.0:1 on --vd-field, --vd-surface-raised, --vd-surface-subtle, --vd-tint, --vd-surface-brand (worst was 2.01:1, now 3.01:1)"
  ],
  "roles": {
    "--vd-surface": "#2E3440",
    "--vd-surface-subtle": "#3B4252",
    "--vd-surface-raised": "#3B4252",
    "--vd-surface-brand": "#40505D",
    "--vd-text": "#D8DEE9",
    "--vd-text-secondary": "#B8C0CB",
    "--vd-control-border": "#919CB1",
    "--vd-action": "#88C0D0",
    "--vd-on-action": "#2E3440",
    "--vd-focus": "#88C0D0",
    "--vd-line": "#6F7D98",
    "--vd-field": "#3B4252",
    "--vd-tint": "#40505D",
    "--vd-soft": "#3B4252",
    "--vd-muted": "#A6AFBE",
    "--vd-divider": "rgba(216, 222, 233, 0.24)",
    "--vd-panel-line": "#6F7D98",
    "--vd-badge-fill": "#40505D",
    "--vd-badge-line": "#6F7D98",
    "--vd-code-surface": "#1B1F26",
    "--vd-scrim": "rgba(0, 0, 0, 0.6)",
    "--vd-status-success": "#B0C79C",
    "--vd-status-warning": "#EBCB8B",
    "--vd-status-error": "#E1B4B9",
    "--vd-status-success-tint": "transparent",
    "--vd-status-warning-tint": "transparent",
    "--vd-status-error-tint": "transparent",
    "--vd-chart-1": "#88C0D0",
    "--vd-chart-2": "#81A1C1",
    "--vd-chart-3": "#B48EAD",
    "--vd-chart-4": "#84B0C8",
    "--vd-chart-outline": "#88C0D0",
    "--vd-chart-grid": "rgba(216, 222, 233, 0.24)",
    "--vd-heat-0": "#3B4252",
    "--vd-heat-1": "#495E6B",
    "--vd-heat-2": "#60818F",
    "--vd-heat-3": "#74A1B0",
    "--vd-heat-4": "#88C0D0"
  }
}
