{
  "id": "catppuccin-mocha",
  "name": "Catppuccin Mocha",
  "scheme": "dark",
  "source": "https://github.com/catppuccin/catppuccin",
  "author": "Catppuccin",
  "license": "MIT",
  "attribution": "Catppuccin Mocha",
  "changes": [
    "control-border: #45475A -> #666985 to reach 3.0:1 on #1E1E2E",
    "--vd-control-border: #666985 -> #777B97 to reach 3.0:1 on --vd-surface, --vd-field, --vd-surface-raised, --vd-surface-subtle (worst was 2.35:1, now 3.03:1)",
    "--vd-link: added as #89B4FA; --vd-surface-hover: added as #1E1E2E (the page surface, as the design system's own dark theme does), both roles the design system's theme contract now requires"
  ],
  "roles": {
    "--vd-surface": "#1E1E2E",
    "--vd-surface-subtle": "#313244",
    "--vd-surface-raised": "#313244",
    "--vd-surface-brand": "#333C57",
    "--vd-text": "#CDD6F4",
    "--vd-text-secondary": "#A6ADC8",
    "--vd-control-border": "#777B97",
    "--vd-action": "#89B4FA",
    "--vd-on-action": "#1E1E2E",
    "--vd-focus": "#89B4FA",
    "--vd-line": "#666985",
    "--vd-field": "#313244",
    "--vd-tint": "#333C57",
    "--vd-soft": "#313244",
    "--vd-muted": "#A6ADC8",
    "--vd-divider": "rgba(205, 214, 244, 0.24)",
    "--vd-panel-line": "#666985",
    "--vd-badge-fill": "#333C57",
    "--vd-badge-line": "#666985",
    "--vd-code-surface": "#181825",
    "--vd-scrim": "rgba(0, 0, 0, 0.6)",
    "--vd-status-success": "#A6E3A1",
    "--vd-status-warning": "#F9E2AF",
    "--vd-status-error": "#F38BA8",
    "--vd-status-success-tint": "transparent",
    "--vd-status-warning-tint": "transparent",
    "--vd-status-error-tint": "transparent",
    "--vd-chart-1": "#89B4FA",
    "--vd-chart-2": "#CBA6F7",
    "--vd-chart-3": "#F5C2E7",
    "--vd-chart-4": "#AAADF8",
    "--vd-chart-outline": "#89B4FA",
    "--vd-chart-grid": "rgba(205, 214, 244, 0.24)",
    "--vd-heat-0": "#313244",
    "--vd-heat-1": "#3E4B6B",
    "--vd-heat-2": "#59709E",
    "--vd-heat-3": "#7193CD",
    "--vd-heat-4": "#89B4FA",
    "--vd-link": "#89B4FA",
    "--vd-surface-hover": "#1E1E2E"
  }
}
